{
  "format": "veri7vn.package/0",
  "package": {
    "id": "org.veri7vn.examples.sqrt",
    "version": "0.1.0",
    "title": "Real square-root example",
    "description": "Illustrative descriptor; native export names here are fixture data, not an installed specialist."
  },
  "files": [
    {
      "path": "observations.json",
      "role": "data"
    }
  ],
  "requires": [],
  "capabilities": []
}
