{
  "format": "veri7vn.package/0",
  "package": {
    "id": "org.veri7vn.examples.sqrt",
    "version": "0.1.0",
    "title": "Real square-root example",
    "description": "Illustrative descriptor; native export names here are fixture data, not an installed specialist."
  },
  "files": [
    {
      "path": "ROOT",
      "role": "source"
    },
    {
      "path": "Sqrt_Example.thy",
      "role": "source"
    },
    {
      "path": "examples/negative-input.json",
      "role": "example"
    },
    {
      "path": "README.md",
      "role": "documentation"
    }
  ],
  "requires": [],
  "native": {
    "session": "Veri7vn_Sqrt_Example",
    "theories": [
      "Sqrt_Example"
    ]
  },
  "capabilities": []
}
